{
  "api_version": "crp.cheesewaf.io/notifier/v1",
  "provider_id": "official-datadog-events-1.0.0",
  "type": "datadog",
  "version": "1.0.0",
  "namespace": "official/notifier-datadog",
  "source": "future-contract",
  "source_root": "vendor-root-v1",
  "config_schema": {
    "dialect": "cheesewaf-notifier-config/v1",
    "fields": [
      { "name": "status", "kind": "enum", "required": true },
      { "name": "priority", "kind": "enum", "required": false },
      { "name": "host", "kind": "string", "required": false, "max_length": 255 },
      { "name": "aggregation_key", "kind": "string", "required": false, "max_length": 100 },
      { "name": "tags", "kind": "string", "required": false, "max_length": 512 }
    ]
  },
  "secret_fields": ["api_key_ref"],
  "endpoint_templates": [
    {
      "name": "notify",
      "url_template": "https://event-management-intake.datadoghq.com/api/v2/events",
      "method": "POST",
      "egress_owner": "cheesewaf-core",
      "variables": []
    }
  ],
  "capabilities": ["alert_delivery", "test_delivery"],
  "publication": { "status": "planned", "installable": false, "crp_binding": "descriptor-only" }
}
